name,address,city,state,county,phone,website,service_type,hours,notes,active
Church of the Assumption Food Pantry,113 Coolidge Place,Roselle Park,NJ,Union,908-245-1107,,Food Pantry,Tuesday 8:30am–10:00am,No referral needed but registration is required. Please call first.,true
Immaculate Heart of Mary Food Pantry,1571 Martine Avenue,Scotch Plains,NJ,Union,908-889-2100,,Food Pantry,Wednesday 10:00am–11:30am; Every 2nd Sunday of the Month,No referral needed but registration is required. Please call first.,true
Mt. Teman AME Church Food Pantry,160 Madison Avenue,Elizabeth,NJ,Union,908-351-2625,,Food Pantry,Thursday 9:00am–1:00pm,No referral needed but registration is required. Please call first.,true
Salvation Army Food Pantry,1005 East Jersey Street,Elizabeth,NJ,Union,908-352-7057,,Food Pantry,By Appointment Only,Please ask for the Food Pantry Coordinator. No referral needed but registration is required. Please call first.,true
Salvation Army Soup Kitchen,1005 East Jersey Street,Elizabeth,NJ,Union,908-352-7057,,Soup Kitchen,Please call for schedule,,true
St. Theresa Social Concerns Food Pantry,541 Washington Ave,Kenilworth,NJ,Union,908-272-4444,,Food Pantry,Tuesday & Thursday 10:00am–12:00pm; Wednesday 6:00pm–7:00pm,No referral needed but registration is required. Please call first.,true
Westfield Food Pantry,425 North Avenue East,Westfield,NJ,Union,908-232-2311,,Food Pantry,Monday–Friday 9:30am–11:00am (By Appointment Only),Requires referral from CCANNJ Case Manager. Contact EFNN Office at 908-497-3903 or Community Access at 1-800-227-7413 for assistance.,true
